date,employee_title,location,employee_status,review_title,helpful,pros,cons,advice_to_mgmt,rating_overall,rating_balance,rating_culture,rating_career,rating_comp,rating_mgmt,recommends,positive_outlook,approves_of_CEO
Tue Jul 04 2017," Program Management and Analysis, Software Engineering","Toronto, ON",Current Employee ,"Software Engineering,Product Management",1,"IT'S USED TO GAIN KNOWLEDGE. They have a free 3 meals a day and snacks that is good. 4 month of paternity and maternity leave that you can distribute over the first year after having the child. it's opt-in health insurance, so it's not really a benefit. they just enjoy group discounts on insurance because they have a million....
","The worst thing about working at Facebook for me has been oncall duty. Most engineering teams run complex, frequently modified software in production. Since things have a way of going wrong, teams have a rotating responsibility for responding to unanticipated emergencies. Since these can happen any time, day or night, and are of unknowable scope and severity, being is a serious responsibility; many millions of users are affected every minute the site is broken.
",,5,5,2,5,5,2,Recommends,Positive Outlook,Approves of CEO
Wed Dec 07 2016,N/A,"London, ON","Client Partner in London, ON",Partner manager,0,"awesome team, good salary, strong perks, flexible hrs
","rigid management, progression slow, slow strategy, more experienced management
",,5,,,,,,Recommends,Positive Outlook,Approves of CEO
Sun Apr 29 2018, Sales Manager,"Toronto, ON",Former Employee ,Fun place to work,1,"Tons of autonomy, lots of career progression opportunity, freedom to think, great management team
","Getting large quickly and beginning to feel big. Negative press cycles take a toll on employee morale.
Helpful (1",,5,4,5,5,5,5,Recommends,Positive Outlook,Approves of CEO
Tue Feb 27 2018,Anonymous,,Former Employee ,"Strong teams, interesting work",0,"Ability to solve complex and interesting problems with truly world-class teams. Focus on people.
","Working in such a large campus, in a very crowded tech ecosystem, there are a lot of potential distractions.
Advice to Management
Keep up the good work — minimize distractions, focus on people, and continue building stellar teams.
Helpfu","Keep up the good work — minimize distractions, focus on people, and continue building stellar teams.
Helpfu",4,4,4,4,5,3,Recommends,Positive Outlook,No Opinion of CEO
Tue Jul 04 2017," Program Management and Analysis, Software Engineering","Toronto, ON",Current Employee ,"Software Engineering,Product Management",1,"IT'S USED TO GAIN KNOWLEDGE. They have a free 3 meals a day and snacks that is good. 4 month of paternity and maternity leave that you can distribute over the first year after having the child. it's opt-in health insurance, so it's not really a benefit. they just enjoy group discounts on insurance because they have a million....
","The worst thing about working at Facebook for me has been oncall duty. Most engineering teams run complex, frequently modified software in production. Since things have a way of going wrong, teams have a rotating responsibility for responding to unanticipated emergencies. Since these can happen any time, day or night, and are of unknowable scope and severity, being is a serious responsibility; many millions of users are affected every minute the site is broken.
Advice to Management
Check Your Wall-posting Preferences
Use Insights to Determine What’s Working for Your Page
 Assign Admin Roles
Helpful (1","Check Your Wall-posting Preferences
Use Insights to Determine What’s Working for Your Page
 Assign Admin Roles
",5,5,2,5,5,2,Recommends,Positive Outlook,Approves of CEO
Wed Dec 07 2016,N/A,"London, ON","Client Partner in London, ON",Partner manager,0,"awesome team, good salary, strong perks, flexible hrs
","rigid management, progression slow, slow strategy, more experienced management
Advice to Management
more streamlined processes
Helpfu","more streamlined processes
Helpfu",5,,,,,,Recommends,Positive Outlook,Approves of CEO
Mon Sep 12 2016,N/A,, ,Fb Intern in winter,0,"Amazing benefits, great work life balance, treated me like a full time, really helped in my development
","Honestly, no real cons to talk about, perhaps that the opportunity to get a full time isnt really present
Advice to Management
They know how to run a company, but perhaps they should be more in tune with their intern development
Helpfu","They know how to run a company, but perhaps they should be more in tune with their intern development
Helpfu",5,5,5,5,5,5,Recommends,Positive Outlook,Approves of CEO
Tue May 24 2016,N/A,, ,Facebook!,0,"Culture was amazing to be working in
","there weren't any cons to this job
Helpfu",,5,5,5,5,5,5,Recommends,Positive Outlook,Approves of CEO
Mon Apr 25 2016,N/A,, ,Accessibility Specialist,1,"It may sound cliche but the thing I liked the most was the constant push/encouragement to always do/be better. I felt challenged, ""move fast & break things"" was real, but I look back with appreciation.
","Very intense work environment and aggressive deadlines. Of course, take this with a grain of salt. Our team was small at the time and we had a lot of pressure to deliver.
",,4,3,4,4,4,,,,
Fri Apr 01 2016,N/A,, ,engineer,0,"great all around, fun, challenging, good compensation
","demanding, micro management, lack of independence
Helpfu",,5,4,5,5,5,4,Recommends,Positive Outlook,Approves of CEO
Mon Mar 14 2016,N/A,, ,Facebook,0,"Awesome benefits and great culture
","Work/Life balance can sometimes be a bit lacking
Helpfu",,4,,,,,,,,
Tue Jan 12 2016,N/A,, ,Data Analyst,0,"Great people and great environment
","None, everything is great always
",,5,4,5,5,4,4,Recommends,Positive Outlook,Approves of CEO
Sun Jul 05 2015,N/A,,Specialist ,Great Place,1,"Awesome workplace with lots of energetic people! It's a fast-paced culture where the only way to move forward is to constantly have an impact. It's a great place to push for fresh ideas and provide input and work on projects that you are passionate about.
","Since teams are distributed around other offices, it sometimes takes longer for decisions to be made.
",,4,4,5,4,3,4,Recommends,Positive Outlook,Approves of CEO
Fri Aug 22 2014,Anonymous,,Current Employee ,Fast-paced Growth,2,"Great culture of moving fast, open and transparent, focus on impact Excellent people that are both smart and empathetic (not found in all tech companies) Managers are focused on growing people long-term
","You'll often get responsibilities faster than you can comfortably deal with them. Not a place where you can phone it in. Company is growing fast and so there's overhead associated with that.
",,5,5,5,5,5,5,Recommends,Positive Outlook,Approves of CEO
Mon Jun 30 2014, Software Engineer,"Vancouver, BC",Current Employee ,"Great place to work at, but pressure tends to be high.",15,"1) Ownership of software 2) Responsibilities are given 3) No lack of projects 4) Compensation and package is awesome
","1) Pressure tends to be high 2) long working hours 3) Management is ineffective 4) Managers sometimes aren't very understanding 5) A lot of employees have the fear of getting fired for performance
",,3,2,2,4,5,2,Doesn't Recommend,Positive Outlook,Approves of CEO
Mon Apr 14 2014,N/A,, ,User operations specialist,0,"Culture, innovation, focus on impact, perks, flexibility
","Sometimes you are defined just by your role. Perception of employees in global offices is less than those a the head office.
",,4,,,,,,,,
Tue Jan 12 2016,N/A,, ,Data Analyst,0,"Great people and great environment
","None, everything is great always
Advice to Management
keep doing what youre doing
Helpfu","keep doing what youre doing
Helpfu",5,4,5,5,4,4,Recommends,Positive Outlook,Approves of CEO
Sun Jul 05 2015,N/A,,Specialist ,Great Place,1,"Awesome workplace with lots of energetic people! It's a fast-paced culture where the only way to move forward is to constantly have an impact. It's a great place to push for fresh ideas and provide input and work on projects that you are passionate about.
","Since teams are distributed around other offices, it sometimes takes longer for decisions to be made.
Helpful (1",,4,4,5,4,3,4,Recommends,Positive Outlook,Approves of CEO
Fri Aug 22 2014,Anonymous,,Current Employee ,Fast-paced Growth,2,"Great culture of moving fast, open and transparent, focus on impact
Excellent people that are both smart and empathetic (not found in all tech companies)
Managers are focused on growing people long-term
","You'll often get responsibilities faster than you can comfortably deal with them. Not a place where you can phone it in.
Company is growing fast and so there's overhead associated with that.
Helpful (2",,5,5,5,5,5,5,Recommends,Positive Outlook,Approves of CEO
Mon Jun 30 2014, Software Engineer,"Vancouver, BC",Current Employee ,"Great place to work at, but pressure tends to be high.",15,"1) Ownership of software
2) Responsibilities are given
3) No lack of projects
4) Compensation and package is awesome
","1) Pressure tends to be high
2) long working hours
3) Management is ineffective
4) Managers sometimes aren't very understanding
5) A lot of employees have the fear of getting fired for performance
Helpful (15",,3,2,2,4,5,2,Doesn't Recommend,Positive Outlook,Approves of CEO
Mon Apr 14 2014,N/A,, ,User operations specialist,0,"Culture, innovation, focus on impact, perks, flexibility
","Sometimes you are defined just by your role. Perception of employees in global offices is less than those a the head office.
Helpfu",,4,,,,,,,,
Sun Mar 02 2014, Software Engineer,,Current Employee ,Fantastic,4,"* Compensation, you will be compensated fairly well but don't expect to be super rich
* Impactful, with Facebook serving 1.23 billion people, a simple change you make can either reach millions of people or improve Facebook's efficiency greatly
* Relaxing work environment, while there are deadlines to be met, its how you reach those deadlines that matter. Work life balance is easy.
","* To get the main benefit, work in HQ, I've worked in other offices and felt I never got the same treatment
* Big company, Facebook isn't as small as it used to be, so if you want to be heard. Make sure to make some noise
Helpful (4",,5,4,4,3,3,4,Recommends,Positive Outlook,Approves of CEO
Thu Feb 07 2013,N/A,, ,Amazing Culture,1,"Everyone is relied upon and valued. They expect you to be the best, which also evokes the best from you.
","Even though they preach about having work-life balance, it is very difficult to with the amount of work needed. However, this applies to all companies that aim to run as efficiently as Facebook does.
",,5,3,5,3,5,5,Recommends,Positive Outlook,Approves of CEO
Thu Sep 20 2012, Client Partner,"Toronto, ON",Current Employee ,"Fantastic Culture, Colleagues, Learning Experience, and an Overall Great Opportunity!",4,"An incredible culture and great group of people to be around.
","The work itself is quite rigorous and difficult.
Helpful (4",,5,3,5,4,4,5,Recommends,Positive Outlook,Approves of CEO
Sun May 24 2020, Engineering Manager,"San Francisco, CA",Current Employee ,People Focused,101,"Facebook deeply cares about its employees and has built a compelling culture around support and growth. Career growth opportunities are plentiful. If you don't like the team you're on or don't get the support you want from your manger, Facebook empowers you to find new teams or projects. Facebook wants its employees to be invested in their work and to feel connected to its larger mission. If large scale opportunities and growth are important to you, Facebook is a fantastic place to work.
","Facebook's culture is demanding and fast paced. The greatest aspect of working at Facebook is that everyone is very motivated and very smart. The problem with this is that they all expect the very same of you. Holding a very high bar for excellence can certainly be demanding so it's important to make sure you're always carefully paying attention to your own personal work/life balance.
",,5,3,5,5,5,5,Recommends,Positive Outlook,Approves of CEO
Wed Feb 10 2021, IT Recruiter,"London, England",Current Employee ,The best company I have worked for!,0,"Benefits, perks, flexibility, freedom to do your own thing. Everyone's super nice and you have the opportunities to work with and learn from some seriously talented individuals.
","The performance review process can be very stressful.
",,5,4,5,4,5,5,Recommends,Positive Outlook,Approves of CEO
Wed Feb 10 2021,Anonymous,,Current Employee ,Flexible,0,"Amazing benefits and work life balance
","Big company and move slow
Helpfu",,5,5,3,3,4,5,Recommends,Positive Outlook,Approves of CEO
Wed Feb 10 2021, Content Designer,"Fremont, CA",Current Employee ,Amazing company to work for!,0,"PERMANENT REMOTE WORK OPTIONS!!! Too many to list. Benefits, compensation, ownership of your career path, complete autonomy, freedom to focus on the work you feel most passionately about.
","I'm still in the honeymoon phase. Glassdoor is forcing me to fill this out to look at something, :)
",,5,5,5,5,5,5,Recommends,Positive Outlook,Approves of CEO
Wed Feb 10 2021, Network Engineer Deployment and Support,"Ashburn, VA",Current Employee ,Great company,0,"Above average benefits. Freedom to work your way and learn anything you want to learn.
","Can be a sink or swim environment
Helpfu",,5,5,4,5,5,4,Recommends,Positive Outlook,Approves of CEO
Wed Feb 10 2021, Facebook Sales,"Santa Clara, CA",Current Employee ,Good,0,"Generally enjoy the culture and sales team
","Would love more upwards mobility
Helpfu",,5,,,,,,,,
Wed Feb 10 2021, Production Support Engineer,"London, England",Former Employee ,Well looked after,0,"Benefits, Pay, Work life balance, Beginner friendly
","None that I can think of
Helpfu",,5,5,5,5,5,5,Recommends,Positive Outlook,Approves of CEO
Sun May 24 2020, Engineering Manager,"San Francisco, CA",Current Employee ,People Focused,101,"Facebook deeply cares about its employees and has built a compelling culture around support and growth. Career growth opportunities are plentiful. If you don't like the team you're on or don't get the support you want from your manger, Facebook empowers you to find new teams or projects. Facebook wants its employees to be invested in their work and to feel connected to its larger mission. If large scale opportunities and growth are important to you, Facebook is a fantastic place to work.
","Facebook's culture is demanding and fast paced. The greatest aspect of working at Facebook is that everyone is very motivated and very smart. The problem with this is that they all expect the very same of you. Holding a very high bar for excellence can certainly be demanding so it's important to make sure you're always carefully paying attention to your own personal work/life balance.
Helpful (101)
Facebook Response
December 4, 2020 – Employer Representative
Thank you for this thoughtful feedback. Building a career at Facebook is about using your unique strengths, doing meaningful work that matters to you and making Facebook better. We're glad you're here on this journey with us",,5,3,5,5,5,5,Recommends,Positive Outlook,Approves of CEO
Wed Feb 10 2021, IT Recruiter,"London, England",Current Employee ,The best company I have worked for!,0,"Benefits, perks, flexibility, freedom to do your own thing. Everyone's super nice and you have the opportunities to work with and learn from some seriously talented individuals.
","The performance review process can be very stressful.
Helpfu",,5,4,5,4,5,5,Recommends,Positive Outlook,Approves of CEO
Wed Feb 10 2021, Content Designer,"Fremont, CA",Current Employee ,Amazing company to work for!,0,"PERMANENT REMOTE WORK OPTIONS!!!
Too many to list. Benefits, compensation, ownership of your career path, complete autonomy, freedom to focus on the work you feel most passionately about.
","I'm still in the honeymoon phase. Glassdoor is forcing me to fill this out to look at something, :)
Helpfu",,5,5,5,5,5,5,Recommends,Positive Outlook,Approves of CEO
Thu Feb 11 2021, Technical Sourcer,"San Francisco, CA",Current Employee ,Fb sourcer,1,"Autonomy to work on what we want
","None that I can think of
Helpful (1",,5,5,5,5,5,5,Recommends,Positive Outlook,Approves of CEO
Sun Feb 07 2021, Client Solutions Manager,"London, England",Current Employee ,Incredible company,1,"team work, colleagues, smart people, compensation, meaningful work
","scrutiny in public, impact on image
Helpful (1",,5,5,5,5,3,5,Recommends,Positive Outlook,Approves of CEO
Tue Feb 09 2021, Software Developer,"Los Angeles, CA",Current Employee ,Top company,0,"Many useful perks and office commodities
","No real cons. Everything is fine
Helpfu",,5,4,4,4,5,4,Recommends,Positive Outlook,
Tue Feb 09 2021, Computer Science,"Seattle, WA",Former Employee ,aaa,0,"overall decent and great experience
","work life balance is crazy
Helpfu",,5,,,,,,,,
Wed Feb 10 2021, Software Engineer,"San Francisco, CA",Current Employee ,Good,0,"good pay more PTO nice experiment
","none none none none none
Helpfu",,5,,,,,,,,
Wed Feb 10 2021, Software Engineer,"Seattle, WA",Current Employee ,E4 Software Engineer,0,"Good benefits and good people
","Stressful promotion timeline and fewer benefits than Google
Helpfu",,5,,,,,,,,
Wed Feb 10 2021, Product Designer,,Current Employee ,gooooood,0,"interesting product space, smart people
","hard to promo, work scope could be small
Helpfu",,5,,,,,,,,
Wed Feb 10 2021, Engineer,,Current Employee ,Good,0,"Benefits, horizontal decision making, culture
","I would not say there are any
Helpfu",,5,,,,,,,,
Mon Feb 08 2021, Solutions Engineer,"São Paulo, São Paulo",Current Employee ,Awesome,0,"environment, compensation, wfh polices and people
","there isn't downsides in the company
Helpfu",,5,5,5,5,5,5,Recommends,Positive Outlook,Approves of CEO
Mon Feb 08 2021, Software Engineer,"San Francisco, CA",Current Employee ,Thumbs up,0,"Laid back, chill, great perks
","Project managers can be all over the place
Helpfu",,5,,,,,,,,
Tue Feb 09 2021, Senior Account Manager,,Current Employee ,Company that cares about the employees,0,"care, salary, work life balance, teamwork
","you need to be ready to have facebook in the tabloides
Helpfu",,5,4,5,3,4,5,,,
Tue Feb 09 2021, Software Engineer,,Current Employee ,Software Engineer,0,"Really a great place to work
","Nothing to mention for this
Helpfu",,5,5,5,5,5,5,,,
Tue Feb 09 2021, Software Engineer,"Menlo Park, CA",Current Employee ,Fun place to work at,0,"High salary, smart people, and cool product
","nothing i can think of
Helpfu",,5,5,5,5,5,5,Recommends,Positive Outlook,Approves of CEO
Sun Feb 07 2021, Analyst,"San Francisco, CA",Current Employee ,Love it here,0,"Competitive salary, smart people, good culture
","Work life balance, long hours
Helpfu",,5,2,4,3,5,5,Recommends,Positive Outlook,Approves of CEO
Sun Feb 07 2021, Technical Recruiter,"London, England",Current Employee ,The company to work for especially during Covid - 19.,0,"Work/Life balance, company culture, leadership and values.
","There are none so far, a lot of negatives are portrayed but not true.
Helpfu",,5,5,5,5,5,5,Recommends,Positive Outlook,Approves of CEO
Sun Feb 07 2021, Software Engineer,Hyderābād,Current Employee ,They are really good,0,"benefits in general are good
","reputation, in general, is very bad
Helpfu",,5,,,,,,,,
Mon Feb 08 2021, Partner Manager,"Dublin, Dublin",Former Employee ,People make the job - couldn't be happier with my time at Fb,0,"The amount of talent at Fb is incredible. Besides that, they hire great people who genuinely care about what it is they do. If not for personal reasons, I'd still be at Fb for sure!
","Due to its sheer size it can be difficult to navigate the organisation, from a career growth perspective as well as making the right connections for your career.
Helpful
Facebook Response
February 10, 2021 – EMEA Recruitment Director
Thanks for your contribution as a Partner Manager in Facebook Ireland and for making the time to share this review. Appreciate the call out on the talent that exists in the company and the care people take in their work and the pride in which they do so. We'll keep working to improve our employee experience and employee value proposition. We'll also keep investing in tools and resources to help team members navigate the complexity that now comes with the size of the company and how geographically dispersed our employee, user and customer base is. We'll also keep shining a light on how we can improve on providing more career growth opportunities for individuals while here. Thanks for your feedback always! Sincerely, Decla",,5,,,,,,Recommends,,Approves of CEO
Mon Feb 08 2021, Visiting Researcher,"Menlo Park, CA",Current Employee ,Good employer,0,"Facebook offers lots of perks.
","There are not many cons to working at Facebook.
Helpfu",,5,5,4,4,5,4,Recommends,Positive Outlook,Approves of CEO
Mon Feb 01 2021, Global Program Manager,"New York, NY",Current Employee ,"Smartest people, impactful opportunities, work that matters.",2,"- Working with the smartest people I've met. - Visible, present leadership. - Incredible salary, benefits, culture. - Opportunity to do work that matters in the world. - If you get an offer from Facebook, you have to take it. Just trust me!
","- You are in the drivers seat of your career at Facebook, and there's no set growth plan or defined career ladder. This is challenging for some but those who are ambitious will thrive!
",,5,5,5,3,5,5,Recommends,Positive Outlook,Approves of CEO
Thu Feb 04 2021, Front End Engineer,"London, England",Current Employee ,Very Fun work Enviorment,1,#NAME?,#NAME?,,5,,,,,,,,
Thu Feb 04 2021, Front End Engineer,"London, England",Current Employee ,Very Fun work Enviorment,1,#NAME?,"- Stressful Performance Review Cycles
Helpful (1",,5,,,,,,,,
Fri Feb 05 2021, Administrative Assistant,"Los Angeles, CA",Current Employee ,great!,0,"great food and great environment
","sometimes it's get too busy
Helpfu",,5,,,,,,,,
Fri Feb 05 2021, Machine Learning Engineer,"San Jose, CA",Current Employee ,Good,0,"Peers are good. Move fast
","Work life balance is not good
Helpfu",,5,2,5,5,5,5,Recommends,Positive Outlook,Approves of CEO
Sat Feb 06 2021, Key Account Manager,"Dublin, Dublin",Current Employee ,Love it,0,"Everything about facebook is great
","Nothing that pops to mind right now
Helpful
Facebook Response
February 10, 2021 – EMEA Recruitment Director
Thanks for your contribution as an account manager in Facebook Ireland and for making the time to share this review. Appreciate the positive feedback on your experience while here! Much appreciated. Sincerely, Decla",,5,,,,,,,,
Sat Feb 06 2021, Recruiter,Singapore,Former Employee ,Great working environment,0,#NAME?,#NAME?,,5,,,,,,,,
Sat Feb 06 2021, Program Manager,,Current Employee ,A great company,0,"Good coworkers and company values
","Difficult to manage work-life balance
Helpfu",,5,2,5,5,4,3,,,
Sat Feb 06 2021, Software Engineer,"Mountain View, CA",Former Employee ,Top-quality environment!,0,"Food. Food. Food. Food. Food.
","No cons whatsoever (not that i aware of)!
Helpfu",,5,5,5,5,5,5,Recommends,Positive Outlook,Approves of CEO
Mon Feb 01 2021, Software Engineer,"New York, NY",Current Employee ,"Smartest people, impactful opportunities, work that matters.",1,"""Free food is just the beginning"" (in 399 reviews) ""Great environment and brilliant people"" (in 344 reviews)
","""Work-life balance can be tough at times"" (in 487 reviews) ""Sometimes long hours due to working with the US"" (in 99 reviews)
",,5,,,,,,,,
Thu Feb 04 2021, Software Engineer,"Menlo Park, CA",Current Employee ,Good place to start career,0,"Mentorship is great and helpful for young engineers
","Easy to get lost in size of company
Helpfu",,5,,,,,,,,
Thu Feb 04 2021, Software Engineer,"Menlo Park, CA",Current Employee ,Fun,0,"It's a fun job and lots of challenge.
","The work is hard and there are a lot of challenges.
Helpfu",,5,5,,,,,,,
Fri Feb 05 2021, Analyst,"New York, NY",Former Employee ,Great company,0,"good culture working at company
","low pay for amount of work
Helpfu",,5,,,,,,,,
Fri Feb 05 2021, Safety Investigator,"Sunnyvale, CA",Current Employee ,Love Working for Facebook!!,0,"Amazing Maternity/Paternity Leave
Bi-Yearly Bonuses
They helped me relocate for free!
They offer a lot of internal services and other benefits (free meals, $700 a year towards health & exercise, real estate agents, car services)
","It's incredibly difficult to get a promotion.
Helpful
Facebook Response
February 12, 2021 – Employer Representative
Thank you for sharing this feedback. We design our benefits & compensation structure to help you and your family be at your best—physically, emotionally and financially. I hope you get that promotion soon. One of the attributes of being promoted is demonstrating performance at the next level for a sustained period of time. If you haven't already, talk with your manager about ways you can level up. Good luck",,5,5,5,5,5,5,Recommends,Positive Outlook,Approves of CEO
Wed Feb 03 2021, Production Engineer,,Current Employee ,Good place to be,0,"good things to work on
","getting large and bad press
Helpfu",,5,5,5,5,5,5,Recommends,Positive Outlook,Approves of CEO
Wed Feb 03 2021, Solutions Engineer,,Current Employee ,Full autonomy,0,"Smart colleagues, hard problems, respect
","Company getting bigger in terms of employees
Helpfu",,5,,,,,,,,
Thu Feb 04 2021, Data Science Manager,"New York, NY",Current Employee ,There's a reason why only 1 or 2 people leave when theres a scandal,0,"Really amazing place to work. Super smart people, lots of resources to do your job. And unlike the NYTimes says, we're not so evil (FB is not perfect either). Lots of opportunities for career development and to learn about new areas. Pay and benefits are awesome
","According to the NYTimes we are the origin of all the evils
",,5,5,5,5,5,5,Recommends,Positive Outlook,Approves of CEO
