date,employee_title,location,employee_status,review_title,helpful,pros,cons,advice_to_mgmt,rating_overall,rating_balance,rating_culture,rating_career,rating_comp,rating_mgmt,recommends,positive_outlook,approves_of_CEO
Thu Jan 14 2021, Software Engineer,"Toronto, ON",Current Employee ,awesome place to work,0,"great employees, great missing, perks
","some people may dislike you.
Helpfu",,5,,,,,,,,
Wed Feb 10 2021, Senior Software Developer,"Vancouver, BC",Current Employee ,Okay,0,"Location and salary and people and cafe
","Management needs to look in the future
Helpfu",,1,,,,,,,,
Fri Jan 15 2021, Research Scientist,,Former Employee ,Okay work,0,"Smart people and lots of freedom.
","Hard job to get and I found the work uninspiring.
Helpfu",,4,,,,,,,,
Wed Jan 13 2021, Client Partner,"Toronto, ON",Former Employee ,N/A,0,"Work with a good team
","High expectations on growth rates quarter over quarter
Helpfu",,3,,,,,,,,
Mon Dec 14 2020, User Experience Researcher,"Montreal, QC",Current Employee ,6,0,"good and friendly for using to connect.
","none one cons I can think about.
Helpfu",,5,2,2,2,3,2,Recommends,Positive Outlook,Approves of CEO
Fri Dec 11 2020,Anonymous,,Former Employee ,Amazing company,0,"Everything is great in here.
","No cons of any kind
Helpfu",,5,5,5,5,5,5,Recommends,Positive Outlook,Disapproves of CEO
Fri Dec 04 2020, Enterprise Account Executive,"Sydney, NS",Former Employee ,Pretty good,0,"I use fun tech often.
","Big challenges sometimes. So, yeah.
Helpfu",,5,,,,,,,,
Wed Dec 16 2020, Enginerring,"Vancouver, BC",Current Employee ,Black lesbian trans women,0,"Diversity is important in a company
","Other than that I am a chronic liar, NONW
Advice to Management
Get good
Helpfu","Get good
Helpfu",4,5,1,2,4,3,Recommends,Positive Outlook,Disapproves of CEO
Sat Oct 31 2020, Data Science,"Toronto, ON",Current Employee ,Great,0,"Team is okay, too corporate
","Burned out, too much work
Helpfu",,5,,,,,,,,
Thu Oct 29 2020, Legal Project Manager,"Toronto, ON",Current Employee ,Making the world a better place,0,"1) I have the flexibility & have a great deal of input into defining the best approach to my work. 2) Collaborative open environment (lack of silos I've seen elsewhere). 3) Active diversity and inclusion programs. 4) Encouraged to be my authentic self. 5) I always feel encouraged and supported. 6) The work is meaningful and impactful. 7) I feel cared for. 8) Benefits are amazing.
","I simply don't have any. It's not a cop out.. FB simply rocks and I love it.
",,5,5,5,5,4,4,Recommends,Positive Outlook,Approves of CEO
Thu Oct 29 2020, Legal Project Manager,"Toronto, ON",Current Employee ,Making the world a better place,0,"1) I have the flexibility & have a great deal of input into defining the best approach to my work.
2) Collaborative open environment (lack of silos I've seen elsewhere).
3) Active diversity and inclusion programs.
4) Encouraged to be my authentic self.
5) I always feel encouraged and supported.
6) The work is meaningful and impactful.
7) I feel cared for.
8) Benefits are amazing.
","I simply don't have any. It's not a cop out.. FB simply rocks and I love it.
Helpfu",,5,5,5,5,4,4,Recommends,Positive Outlook,Approves of CEO
Wed Dec 02 2020, Manager,"Toronto, ON",Former Employee ,ok company,0,"people are good to work with there
","pay and work not fair
Helpfu",,1,,,,,,,,
Tue Oct 27 2020, Technical Sourcer,"Vancouver, BC",Current Employee ,So far so good.....,0,"Be your authentic self, work life balance, adjusted goals during covid
","office closure due to covid, specific job nuances
Helpfu",,5,4,4,5,2,4,Recommends,Positive Outlook,Approves of CEO
Sun Sep 13 2020,Anonymous,,Current Employee ,Great experience,0,"Great compagny to work for
","Nothing, I can only see advantages
Helpfu",,5,,,,,,,,
Thu Sep 10 2020, Technical Sourcer,"Vancouver, BC",Current Employee ,People Focused Company,0,"I have worked here less than a year so far, but I have loved every minute of it! I joined during COVID and it became clear extremely quickly how much they deeply care about their employees and their well being. Can work-life balance be challenging in a company full of top performers with high performance expectations? Absolutely! But it is really on you to manage your own time and success. There is no pressure from the organization to work after hours and using your PTO and leave options is greatly encouraged. 

I personally love the casual and open culture. When they say ""bring your whole self to work"" they mean it. Coming from a more traditional company it took a little time to adapt to this as well as to adjust to how people communicate with each other but now I'm hooked. 

The opportunities for continued learning and professional growth seem boundless. They really like to promote from within and there are so many resources for building your career based around what interests you the most.
","One challenging aspect is that everyone has an option about Facebook and we are constantly on the news, but that's true of any top company. Recruiters should be used to having tough skin anyways.
Helpfu",,5,4,5,5,5,5,Recommends,Positive Outlook,Approves of CEO
Thu Sep 10 2020, Technical Recruiter,"Vancouver, BC",Current Employee ,Very Positive requesting,0,"- FB has done an incredible job of creating a positive culture. For a company of this size I'm amazed at how supportive everyone is. - There is a strong culture of competence. - Lots of room for career growth + guidance from management on how to get there - Explicit/formulaic bonus structure. It's not having zero ambiguity
","There is so much new information coming out every day. If you don't dedicate time to read it (roughly 1 hour per day) you will quickly fall behind
",,5,5,5,5,5,5,Recommends,Positive Outlook,Approves of CEO
Tue Sep 22 2020, Software Engineer,"Vancouver, BC",Former Employee ,good,0,"good salary stress very less
","hectic work load time very high
Helpfu",,4,3,3,3,3,3,Recommends,Neutral Outlook,No Opinion of CEO
Tue Sep 15 2020, Technical Sourcer,,Current Employee ,Good company for growth and learning,0,"Lots of really smart and talented people who are supportive and willing to help Really solid career growth if you can perform well, the team's are very data driven so it is easy to track goals and understand if you are doing well or not.
","Working for a company that is always in the limelight can be quite difficult especially in roles where you always have to interface with external people who might not have a positive view of the company.
",,4,4,4,5,5,4,Recommends,Positive Outlook,No Opinion of CEO
Fri Aug 21 2020, Software Developer,N/A,Former Employee ,Great Experience,0,"Great company to work at
","If you don't like IT, don't go there
Helpfu",,5,,,,,,,,
Mon Jul 27 2020, Data Analyst,"Toronto, PE",Current Employee ,pretty good,0,"good pay and flexible free time
","same thing every single day
Helpfu",,3,3,3,3,3,3,Doesn't Recommend,Neutral Outlook,No Opinion of CEO
Wed Jul 22 2020, Data Scientist,,Current Employee ,"good pay, bad everything else",0,"Strong engineering culture and high pay
","Stressful, bad work life balance, political coworkers, bad company mission
Helpfu",,1,,,,,,Doesn't Recommend,Neutral Outlook,Disapproves of CEO
Tue Sep 15 2020, Technical Sourcer,,Current Employee ,Good company for growth and learning,0,"Lots of really smart and talented people who are supportive and willing to help
Really solid career growth if you can perform well, the team's are very data driven so it is easy to track goals and understand if you are doing well or not.
","Working for a company that is always in the limelight can be quite difficult especially in roles where you always have to interface with external people who might not have a positive view of the company.
Helpfu",,4,4,4,5,5,4,Recommends,Positive Outlook,No Opinion of CEO
Fri May 29 2020, Director,"Toronto, ON",Current Employee ,A great place to make an impact in the world,0,"Fast pace, focus on innovation everyday, and you have the freedom to do your best work and make an impact. Extremely talented people across all functions of the company.
","The culture is very unique and takes about 1 year to truly get integrated into the company.
Helpfu",,5,5,5,5,5,5,Recommends,Positive Outlook,
Thu May 14 2020, Community Operations Analyst,"Toronto, ON",Former Employee ,Everything is perfectly sorted,0,"All you need to do is finish the work that is assigned. Nobody will bother you. Cool managers. Very good work environment.
","No Cons to be honest.
",,5,5,5,5,5,5,Doesn't Recommend,Positive Outlook,Approves of CEO
Mon Apr 20 2020, Research Engineer,,Current Employee ,Surprised... in a very positive way!,0,"I must admit I was wary of joining Facebook, after all the public scandals like Cambridge Analytica, moderators' work conditions, etc. From the outside, it seemed like an evil company eager to make money by exploiting masses. I talked to a lot of people before accepting the offer, and they convinced me I should give them a chance. I don't regret it at all, as internally you can see how everyone's trying their best to make this company useful for society at large (yes, making money at the same time, but definitely not as the primary driver of decisions being made). In the end I found a job where I got a significant salary boost, I'm tackling very interesting research problems, and work with people whom I appreciate and whose technical expertise I can trust. So I'm very happy with my choice! :)
","The main drawback is the public perception of the company. But as I mentioned the reality is a lot more nuanced than what you can read in the media.
",,5,4,4,5,5,5,Recommends,Positive Outlook,Approves of CEO
Mon Feb 10 2020, Software Engineer,,Former Employee ,Scored via Healr but here's a review,0,"Good people who seem to care.
","They need to offer better training to grow people. Sometimes you can feel forgotten, and things feel a bit rushed.
",,5,,,,,,,,
Wed Nov 20 2019, Manager,N/A,Former Employee ,manager,0,"manager manager manager manager manager
","Career Opportunities Career Opportunities Career Opportunities
Helpfu",,4,4,4,4,4,4,Recommends,Positive Outlook,
Tue Nov 19 2019, Account Executive,,Former Employee ,"Great people, fantastic culture and evolving through a tough transition.",0,"Fast paced, challenging, smart people, strong solutions.
","High growth and higher expectations.
Helpfu",,4,,,,,,,,
Sat Oct 26 2019,Anonymous,,Former Employee ,Amazing,0,"Working with smart people Great perks and comp
","Horrible bi-annual evaluation process
",,5,4,5,5,5,3,Recommends,Positive Outlook,Approves of CEO
Sun Sep 15 2019, Software Engineer,,Current Employee ,Nice working place,1,"Nice working place in general.
","Very intensive place. A lot of pressure
Helpful (1",,3,,,,,,,,
Wed Oct 02 2019, Software Engineer,,Former Employee ,worst company ever,0,"none. fair pay if I must say.
","worst company ever, company is a monopoly!
Helpfu",,1,1,1,1,1,1,Doesn't Recommend,Negative Outlook,Disapproves of CEO
Sun Aug 11 2019, Production Engineer Co,,Former Employee ,Great company to intern at,0,"free food, free housing, lots of flexibility with intern projects
","can be stressful at times if you are trying to get a returning full-time offer
Helpfu",,5,,,,,,,,
Mon Apr 20 2020, Research Engineer,,Current Employee ,Surprised... in a very positive way!,0,"I must admit I was wary of joining Facebook, after all the public scandals like Cambridge Analytica, moderators' work conditions, etc. From the outside, it seemed like an evil company eager to make money by exploiting masses.
I talked to a lot of people before accepting the offer, and they convinced me I should give them a chance. I don't regret it at all, as internally you can see how everyone's trying their best to make this company useful for society at large (yes, making money at the same time, but definitely not as the primary driver of decisions being made).

In the end I found a job where I got a significant salary boost, I'm tackling very interesting research problems, and work with people whom I appreciate and whose technical expertise I can trust. So I'm very happy with my choice! :)
","The main drawback is the public perception of the company. But as I mentioned the reality is a lot more nuanced than what you can read in the media.
Helpfu",,5,4,4,5,5,5,Recommends,Positive Outlook,Approves of CEO
Mon Feb 10 2020, Software Engineer,,Former Employee ,Scored via Healr but here's a review,0,"Good people who seem to care.
","They need to offer better training to grow people. Sometimes you can feel forgotten, and things feel a bit rushed.
Helpfu",,5,,,,,,,,
Sat Oct 26 2019,Anonymous,,Former Employee ,Amazing,0,"Working with smart people
Great perks and comp
","Horrible bi-annual evaluation process
Advice to Management
Get rid of PSC. It's poison.
Helpfu","Get rid of PSC. It's poison.
Helpfu",5,4,5,5,5,3,Recommends,Positive Outlook,Approves of CEO
Wed Aug 07 2019, Sales Associate,,Former Employee ,Fun job great people to work around,0,"Fun job, great people to work with
","Tough managers who expect overtime quite regularly
Advice to Management
N/A
Helpfu","N/A
Helpfu",5,,,,,,,,
Wed Apr 24 2019,Anonymous,,Former Employee ,Recruiter,0,#NAME?,#NAME?,,5,4,4,3,5,4,Recommends,Neutral Outlook,No Opinion of CEO
Fri Apr 05 2019,Anonymous,,Former Employee ,Analyst,0,"Amazing working life balance is all
","somethings are just too stressful
",,5,5,5,4,5,5,Recommends,Neutral Outlook,Approves of CEO
Tue Apr 02 2019,Anonymous,,Former Employee ,"Great culture, but it can political",0,"Pay, great culture, free food
","Bureaucratic, limited leadership in management team
Helpfu",,5,,,,,,,,
Mon Mar 25 2019,Anonymous,,Current Employee ,Client Solutions Manager,0,"Culture, Experience, Learning, People, Compensation
","Work life balance could be better
Helpfu",,5,,,,,,Recommends,Positive Outlook,Approves of CEO
Tue Sep 18 2018, Client Partner,"Toronto, ON",Current Employee ,Client Partner - Financial Services Better than I could have possibly imagined.,8,"Instead of completing a formal review, I’ll share a post I made to celebrate my 1 year anniversary since joining Facebook. —- Today marks my first year at Facebook. We call it a Faceversary. And, while celebrating your work anniversary might seem a bit frivolous (or at least I thought so early on), I quickly learned to appreciate the FB tradition that’s built around these Faceversaries. It’s valuable to reflect on all that happens in a year at work, considering how much energy, time, and effort we put into it. When you make it to your 10-year milestone (my count down starts now), you get the opportunity to join Mark Zuckerberg, Sheryl Sandberg, and others on the management team to tell a 10-year Faceversary story to the entire company. Those are always funny or emotional, or both. So, what can I share after my first year here? TL;DR: Work with and learn from the very best people. Drinking from the firehose and learning a ton. Autonomy, authority and support. World-class benefits. Open culture to the bones. An inside look at how serious everyone is about minimizing the bad and building more of the good. Five core values in action. Pretty darn happy. I get the pleasure to work with incredible, impressive, and talented people daily. Both within the walls of Facebook, but also with clients and partners who are working on some unbelievable things. My pod and my core team are just legendary. This isn’t lip service. I really get to work with and learn from the very best. I’ve learnt SO MUCH. About digital advertising and marketing. About financial services. About media. About other industry verticals I previously knew nothing about. About navigating complex circumstances. About working for a company that’s constantly in the spotlight. About digging deeper to really understand. About cross-functional collaboration. About partnerships. About technology. And much more. Internally, they say every day at Facebook is equivalent to a week. I now know why. I have the autonomy, authority, and support I need to be successful and run my marketing consulting business the way I see fit. Further, I get to shape and influence how businesses engage, nurture, and build new relationships with people. I have access to incredible benefits that I’m astonished by daily and so grateful for. In fact, I’m writing this post while on paid paternity leave to spend time with my family and our new addition, Logan. Facebook fosters an open culture that is like nothing I’ve ever seen before. Mark hosts a weekly company-wide Q&A where he addresses thoughtful and difficult questions about a wide-range of issues and opportunities. Everyone, from Interns to tenured employees, are welcome to ask anything and they don’t face judgement or criticism for raising difficult topics. On our internal Workplace (Facebook for Work), I can join and learn about a whole host of interesting projects, regardless of whether I’m involved in them. I’ve learnt a lot about both the harmful ways and the incredibly positive ways Facebook can be used. I get a firsthand look at how serious everyone is about minimizing the bad and building more of the good. There are 5 core values that guide how we work at Facebook. And I see them in practice regularly. Build social value. Move fast. Be bold. Be open. Focus on impact. I’ve always been fortunate in my career. I’ve worked on amazing teams, on fascinating projects, with inspiring mentors and leaders. Facebook has been a continuation of that for me. But, I must say, I’ve never been this happy. So, here’s to one amazing year and the many more to follow!
","The bar has been set so high for any future employer to be within my consideration set. I’m truly spoiled.
",,5,5,5,5,5,5,Recommends,Positive Outlook,Approves of CEO
Tue Oct 09 2018,N/A,N/A, ,Good,0,"Yes very good opportunities, good
","No none, none I can remember
Helpfu",,5,5,5,5,5,5,Recommends,Positive Outlook,Approves of CEO
Thu Aug 09 2018,N/A,, ,Best company to work for,0,"Hands down, it’s the best company to work for.
","Work life balance is not great
Helpfu",,5,1,5,5,5,5,Recommends,Positive Outlook,Approves of CEO
Thu Jul 26 2018,Anonymous,,Current Employee ,Open and connected culture,1,"Flat working environment, smart and caring colleagues, they take good care of their employees
","aggressive goals and difficult to balance life and work.
Helpful (1",,5,4,5,5,5,5,Recommends,Positive Outlook,Approves of CEO
Tue Jul 24 2018,Anonymous,,Former Employee ,Amazing place to work at,0,"title, money, reputation prestige and amazing projects
","too many smart people can be intimidating
Helpfu",,5,3,5,5,5,5,,,
Wed Aug 07 2019, Sales Associate,N/A,Former Employee ,Fun job great people to work around,0,"Fun job, great people to work with
","Tough managers who expect overtime quite regularly
Advice to Management
N/A
Helpfu","N/A
Helpfu",5,,,,,,,,
Tue Sep 18 2018, Client Partner,"Toronto, ON",Current Employee ,Client Partner - Financial Services Better than I could have possibly imagined.,8,"Instead of completing a formal review, I’ll share a post I made to celebrate my 1 year anniversary since joining Facebook.
—-

Today marks my first year at Facebook. We call it a Faceversary. And, while celebrating your work 
anniversary might seem a bit frivolous (or at least I thought so early on), I quickly learned to appreciate the FB tradition that’s built around these Faceversaries. It’s valuable to reflect on all that happens in a year at work, considering how much energy, time, and effort we put into it. 

When you make it to your 10-year milestone (my count down starts now), you get the opportunity to join Mark Zuckerberg, Sheryl Sandberg, and others on the management team to tell a 10-year Faceversary story to the entire company. Those are always funny or emotional, or both. 
 
So, what can I share after my first year here? 
 
TL;DR: Work with and learn from the very best people. Drinking from the firehose and learning a ton. Autonomy, authority and support. World-class benefits. Open culture to the bones. An inside look at how serious everyone is about minimizing the bad and building more of the good. Five core values in action. Pretty darn happy. 
 
I get the pleasure to work with incredible, impressive, and talented people daily. Both within the walls of Facebook, but also with clients and partners who are working on some unbelievable things. My pod and my core team are just legendary. This isn’t lip service. I really get to work with and learn from the very best. 
 
I’ve learnt SO MUCH. About digital advertising and marketing. About financial services. About media. About other industry verticals I previously knew nothing about. About navigating complex circumstances. About working for a company that’s constantly in the spotlight. About digging deeper to really understand. About cross-functional collaboration. About partnerships. About technology. And much more. Internally, they say every day at Facebook is equivalent to a week. I now know why. 
 
I have the autonomy, authority, and support I need to be successful and run my marketing consulting business the way I see fit. Further, I get to shape and influence how businesses engage, nurture, and build new relationships with people.

I have access to incredible benefits that I’m astonished by daily and so grateful for. In fact, I’m writing this post while on paid paternity leave to spend time with my family and our new addition, Logan. 
 
Facebook fosters an open culture that is like nothing I’ve ever seen before. Mark hosts a weekly company-wide Q&A where he addresses thoughtful and difficult questions about a wide-range of issues and opportunities. Everyone, from Interns to tenured employees, are welcome to ask anything and they don’t face judgement or criticism for raising difficult topics. On our internal Workplace (Facebook for Work), I can join and learn about a whole host of interesting projects, regardless of whether I’m involved in them. 
 
I’ve learnt a lot about both the harmful ways and the incredibly positive ways Facebook can be used. I get a firsthand look at how serious everyone is about minimizing the bad and building more of the good.

There are 5 core values that guide how we work at Facebook. And I see them in practice regularly. Build social value. Move fast. Be bold. Be open. Focus on impact. 
 
I’ve always been fortunate in my career. I’ve worked on amazing teams, on fascinating projects, with inspiring mentors and leaders. Facebook has been a continuation of that for me. But, I must say, I’ve never been this happy. 
 
So, here’s to one amazing year and the many more to follow!
","The bar has been set so high for any future employer to be within my consideration set. I’m truly spoiled.
Helpful (8",,5,5,5,5,5,5,Recommends,Positive Outlook,Approves of CEO
Mon Jun 11 2018,Anonymous,,Former Employee ,Jr designer,0,"Great culture, good energy
","Too busy! Overwhelming load, was not suitable for Jr designer r
Helpfu",,5,3,5,5,4,3,Doesn't Recommend,Positive Outlook,Approves of CEO
Tue May 29 2018,Anonymous,,Former Employee ,Client Solution Manager,0,#NAME?,"become a bit political after its massive expansion, some of the people that this company hire which some of the colleagues agree that they dont deserve to be here
Advice to Management
be more careful when hiring, make sure the person you hire truly has what it take to be in this company, instead of taking all the benefits Facebook brings and contribute nothing.
Helpfu","be more careful when hiring, make sure the person you hire truly has what it take to be in this company, instead of taking all the benefits Facebook brings and contribute nothing.
Helpfu",5,2,5,4,4,4,Recommends,Positive Outlook,Approves of CEO
Tue Jun 05 2018,Anonymous,,Current Employee ,Full Stack Developer,0,#NAME?,#NAME?,,3,3,3,4,5,3,Doesn't Recommend,Positive Outlook,Disapproves of CEO
Mon Jun 18 2018,Anonymous,,Former Employee ,A total disillusionment,3,#NAME?,#NAME?,,1,1,1,1,5,1,Doesn't Recommend,Negative Outlook,No Opinion of CEO
Sun Apr 29 2018, Sales Manager,"Toronto, ON",Former Employee ,Fun place to work,1,"Tons of autonomy, lots of career progression opportunity, freedom to think, great management team
","Getting large quickly and beginning to feel big. Negative press cycles take a toll on employee morale.
",,5,4,5,5,5,5,Recommends,Positive Outlook,Approves of CEO
Tue Apr 10 2018,Anonymous,,Former Employee ,Coffee consumer,0,"Great
you get to drink coffee
","have to drink too much coffee
Helpfu",,5,5,,,,,Recommends,Positive Outlook,Approves of CEO
Tue Feb 27 2018,Anonymous,,Former Employee ,"Strong teams, interesting work",0,"Ability to solve complex and interesting problems with truly world-class teams. Focus on people.
","Working in such a large campus, in a very crowded tech ecosystem, there are a lot of potential distractions.
",,4,4,4,4,5,3,Recommends,Positive Outlook,No Opinion of CEO
Wed Oct 11 2017,Anonymous,,Former Employee ,Strategist,1,"It was such a great environment!
","Hard pressure environment, lots of people.
Helpful (1",,4,3,4,4,4,4,Recommends,Neutral Outlook,No Opinion of CEO
