date,employee_title,location,employee_status,review_title,helpful,pros,cons,advice_to_mgmt,rating_overall,rating_balance,rating_culture,rating_career,rating_comp,rating_mgmt,recommends,positive_outlook,approves_of_CEO
Thu Feb 04 2021, Technical Recruiter,"London, England",Current Employee ,Great place to work!,0,"Recognition, progression, fulfilling work. The culture is great and is well supported environment.
","No cons, it’s a great place to work.
Helpfu",,5,5,5,5,5,5,Recommends,Positive Outlook,Approves of CEO
Tue Feb 02 2021, Head of Communications,"Menlo Park, CA",Current Employee ,Terrific Company,0,"Terrific place to work. Great.
","Misunderstood company. Bad press. Attacked by govt .
Helpfu",,5,3,5,5,5,5,Recommends,Positive Outlook,Approves of CEO
Tue Feb 02 2021, Business Analyst,Singapore,Former Employee ,"Good environment to work in, but career progression?",0,"Good working environment, great colleagues
","No career progression. Do what you are supposed to do, nothing more, nothing less.
",,5,4,4,4,1,3,Recommends,Positive Outlook,No Opinion of CEO
Tue Feb 02 2021, Director,"San Francisco, CA",Current Employee ,4 years and going strong,0,"Upward progression, fast paced, high-impact, mission driven culture, people
","Moves really fast - have to enjoy that type of environment
Helpfu",,5,4,5,5,5,5,Recommends,Positive Outlook,Approves of CEO
Tue Feb 02 2021, Data Engineer,,Former Employee ,Great place to work,0,"Working with very smart people
","There isn't much of a work life balance. Very long hours
Helpfu",,5,,,,,,Recommends,Positive Outlook,Approves of CEO
Wed Feb 03 2021, Firmware Engineer,"Redmond, WA",Current Employee ,Probably as good as it gets,0,"Interesting work with top-tier colleagues; highly competent, well-intentioned management; good work/life balance; fantastic pay, benefits, and perks. There are many reasons why people want to work here.
","The usual PC drill (though it's really not as bad as you think); may be too good to be true -- everyone knows where good intentions can lead; everybody hates us
",,5,5,5,5,5,5,Recommends,Positive Outlook,Approves of CEO
Tue Feb 02 2021, Business Analyst,Singapore,Former Employee ,"Good environment to work in, but career progression?",0,"Good working environment, great colleagues
","No career progression. Do what you are supposed to do, nothing more, nothing less.
Advice to Management
It's ok to promote people within the team.
Helpfu","It's ok to promote people within the team.
Helpfu",5,4,4,4,1,3,Recommends,Positive Outlook,No Opinion of CEO
Wed Feb 03 2021, Firmware Engineer,"Redmond, WA",Current Employee ,Probably as good as it gets,0,"Interesting work with top-tier colleagues; highly competent, well-intentioned management; good work/life balance; fantastic pay, benefits, and perks. There are many reasons why people want to work here.
","The usual PC drill (though it's really not as bad as you think); may be too good to be true -- everyone knows where good intentions can lead; everybody hates us
Advice to Management
Never forget why you started Facebook in the first place; don't let go your souls; when you dine with the devil, bring a long spoon; illegitimi non carborundum
Helpfu","Never forget why you started Facebook in the first place; don't let go your souls; when you dine with the devil, bring a long spoon; illegitimi non carborundum
Helpfu",5,5,5,5,5,5,Recommends,Positive Outlook,Approves of CEO
Wed Feb 03 2021, Systems Engineer,"Fremont, CA",Current Employee ,Good place to work,0,"Good working environment, overall culture
","Work life balance is far from the best
Helpfu",,5,1,4,5,3,3,Recommends,Positive Outlook,Approves of CEO
Wed Feb 03 2021, Legal Counsel,"Philadelphia, PA",Current Employee ,Good Company- Remote Work Allowed,0,"Remote work, friendly co-workers, growing company
","Hard to get a promotion
Helpfu",,5,,,,,,,,
Wed Feb 03 2021, Product Manager,,Current Employee ,Good company,0,"Great people and benefits, nice place to work
","W/L Balance, lots of teams, alignment
Helpfu",,5,,,,,,,,
Fri Jan 29 2021, Technical Sourcer,"San Francisco, CA",Current Employee ,I Love my Company,1,"Great Benefits, Positive work culture.
","Demanding in terms of metrics.
Helpful (1",,5,4,5,5,5,5,Recommends,Positive Outlook,Approves of CEO
Mon Feb 01 2021,Anonymous,,Current Employee ,Positive working environment,0,"Amazing culture with supportive people
","Require high responsibility to work autonomously
Helpfu",,5,,,,,,,,
Mon Feb 01 2021, Rotational Software Engineer,"New York, NY",Current Employee ,Simply Amazing,0,#NAME?,#NAME?,,5,4,5,5,5,5,Recommends,Positive Outlook,Approves of CEO
Mon Feb 01 2021, Software Engineer,"San Francisco, CA",Former Employee ,Good place to work,0,"It's a dynamic work environment
","It has large company challenges
Helpfu",,5,,,,,,,,
Tue Feb 02 2021,Anonymous,,Current Employee ,Great place to work!,0,"Flexibility, Making a Difference, Opportunities
","Products allow for spread of misinformation
Helpfu",,5,,,,,,,,
Tue Feb 02 2021, Marketing Science Partner,"Austin, TX",Current Employee ,Tech Jobs are Great,0,"Benefits are great for starting a family, work from home policy is reasonable, and there aren't many/any ruts.
","You're still a wage slave.
",,5,,,,,,,,
Sun Jan 31 2021, Software Development Engineer (SDE),"Los Angeles, CA",Current Employee ,facebook engineer salary,0,"At facebook , you can learn a lot
","But you will face intensive stress at the sametime
Helpfu",,5,4,4,4,4,4,Recommends,Positive Outlook,Approves of CEO
Sun Jan 31 2021, Data Scientist,"New York, NY",Former Employee ,FB review,0,"love the facebook culture and working environment
","work-life balance. under lots of pressure
Helpfu",,5,3,5,4,4,5,Recommends,Positive Outlook,Approves of CEO
Sun Jan 31 2021, Technical Sourcer,,Current Employee ,Great place to work!,0,#NAME?,"Occasionally I disagree with the decisions of leadership. There is so much emphasis when you're hired that ""Facebook is your company now"" but then when decisions are made they are very top-down.
Helpfu",,5,5,5,5,5,,,,
Sun Jan 31 2021,Anonymous,,Former Employee ,Amazon,0,"Growth, learning, learning , self development
","Work life balance culture growth
",,5,4,4,4,5,4,,,
Mon Feb 01 2021, Market Specialist,"Dublin, Dublin",Current Employee ,Great balance and culture,0,"What makes Facebook great, is the diversity, talent and opportunities. The benefits are arguably one obvious aspect too, and there is plenty of them!
","No negative experience for now.
",,5,5,5,5,4,4,Recommends,Positive Outlook,Approves of CEO
Mon Feb 01 2021, Analyst,N/A,Former Employee ,Great Place,0,"Great employees and management, advancement opportunities, great benefits
","Long hours, some managers were not professional
Helpfu",,5,3,5,4,4,4,,,
Mon Feb 01 2021, Account Manager,"Austin, TX",Former Employee ,Great role,0,"Easy day-to-day work Fun work environment Good pay
","Honestly, there is nothing that comes to mind
",,5,5,5,5,5,5,,,
Wed Jan 27 2021, Technical Writer,"Menlo Park, CA",Former Employee ,One of the best places to work,1,"Some of the best work opportunities to make a difference. The company is great, as is the culture. It is a collaborative environment, so everyone works together to succeed.
","Unfortunately with a company that is trying to make a huge difference, the work-life balance is not great. Typically you end up working once you get home and occasionally on weekends.
",,5,2,4,5,4,5,Recommends,Positive Outlook,Approves of CEO
Sat Jan 30 2021, Clerk,"Chicago, IL",Former Employee ,A+,0,"Have no complaints, was treated well
","Lots of pressure to perform
Helpfu",,5,5,5,5,5,5,Recommends,Positive Outlook,Approves of CEO
Sun Feb 14 2021,Anonymous,N/A,Former Employee ,Facebook,0,"The pay was really excellent.
","I was constantly overworked and given too little time to complete tasks.
Helpfu",,4,,,,,,,,
Fri Jan 29 2021, Product Manager,"Menlo Park, CA",Former Employee ,Great work environment!,0,"Smart people, flexible hours, great work environment.
","Lots of hierarchy and structure
Helpfu",,5,5,5,4,5,5,Recommends,Positive Outlook,Approves of CEO
Mon Feb 01 2021, Market Specialist,"Dublin, Dublin",Current Employee ,Great balance and culture,0,"What makes Facebook great, is the diversity, talent and opportunities. The benefits are arguably one obvious aspect too, and there is plenty of them!
","No negative experience for now.
Helpful
Facebook Response
February 10, 2021 – EMEA Recruitment Director
Thanks for shining a light on the diversity that exists in Facebook Ireland, with over 100 nationalities represented in our employee base here from my personal experience I love meeting people from almost ever corner of the globe. Also, appreciate the call out on benefits. We'll keep focusing on diversity and as well as fostering an inclusive work environment in every way we can. We'll also keep listening to feedback and trying to improve our employee experience in every way we can. Sincerely, Decla",,5,5,5,5,4,4,Recommends,Positive Outlook,Approves of CEO
Mon Feb 01 2021, Account Manager,"Austin, TX",Former Employee ,Great role,0,"Easy day-to-day work
Fun work environment
Good pay
","Honestly, there is nothing that comes to mind
Helpfu",,5,5,5,5,5,5,,,
Wed Jan 27 2021, Technical Writer,"Menlo Park, CA",Former Employee ,One of the best places to work,1,"Some of the best work opportunities to make a difference. The company is great, as is the culture. It is a collaborative environment, so everyone works together to succeed.
","Unfortunately with a company that is trying to make a huge difference, the work-life balance is not great. Typically you end up working once you get home and occasionally on weekends.
Helpful (1",,5,2,4,5,4,5,Recommends,Positive Outlook,Approves of CEO
Fri Jan 29 2021, Software Engineer,"San Francisco, MO",Current Employee ,Good work,0,"Good exp, learn a lot, good starter job
","Not high salary, could get high salary
Helpfu",,5,,,,,,,,
Fri Jan 29 2021, Legal,,Current Employee ,Great place to work,0,"Awesome colleagues and compensation at FB
","Nothing comes to mind at the moment
Helpfu",,5,4,5,4,5,5,Positive Outlook,,Approves of CEO
Sat Jan 30 2021, Software Engineer(Internship),"Menlo Park, CA",Former Employee ,Productive internship,0,"Very rewarding, learned a lot in 12 weeks
","A bit stressful, virtual internship
Helpfu",,5,4,5,5,5,5,,,
Sat Jan 30 2021, Growth Manager,"Menlo Park, CA",Former Employee ,"Great people, recommend",0,"Great culture, team. Smartest & most passionate people I've worked with in their fields. Large org, so one must navigate.
","Distracting headlines every day. Exec firedrills.
Helpfu",,5,3,3,3,5,5,Recommends,Positive Outlook,
Thu Jan 28 2021, Software Engineer,"Menlo Park, CA",Former Employee ,Loving being in Facebook,0,"It's a really awesome company, and I'm glad that I can work here before
","not really much as I could find
Helpfu",,5,5,5,5,5,5,Recommends,Positive Outlook,Approves of CEO
Fri Jan 29 2021, Customer Success Manager (CSM),"São Paulo, São Paulo",Current Employee ,"Company moves fast, lots of benefits",0,"Great benefits and learning opportunities
","A lot of pressure for results
Helpfu",,5,3,5,3,3,5,Recommends,Positive Outlook,
Mon Jan 25 2021, Senior Software Engineer,"London, England",Current Employee ,Excellent,1,"Great people and really interesting projects.
","The long hours are sometimes tedious.
Helpful (1",,5,,,,,,,,
Thu Jan 28 2021, Administrative Assistant,"London, England",Current Employee ,Good,0,"Everything good, wonderful place to work
","Nothing. Everything is really perfect!
Helpfu",,5,5,5,5,5,5,Recommends,Positive Outlook,Approves of CEO
Thu Jan 28 2021, SDE,"Seattle, WA",Current Employee ,Good compnay,0,"Nice company to work at
","None as far as ia m wa
Helpfu",,5,,,,,,,,
Wed Feb 10 2021, Production Engineer,"Menlo Park, CA",Current Employee ,Experience working in Facebook,0,"You can work with very talented engineers.
","The company is very big and the things you work on could be a very small part in the whole picture.
Helpfu",,4,3,4,4,4,4,Recommends,Positive Outlook,No Opinion of CEO
Thu Feb 11 2021, Senior Swe,Tel Aviv-Yafo,Former Employee ,"A great place to be on top, harsh on the less talented",0,"Great benefits and salary, work with lots of smart people
","Stressful, impersonal. Working in the TLV branch can mean lots of struggles communicating with MPK teams.
Helpfu",,4,2,3,4,5,5,,,
Thu Feb 11 2021, Engineering Manager,"Menlo Park, CA",Current Employee ,Great Company,0,"Great company for growing personally and professionally
","performance reviews can be stressful.
Helpfu",,4,,,,,,Approves of CEO,,
Thu Feb 11 2021, Partnership Manager,,Former Employee ,Good,0,"Good compensation package, international environment, open culture
","Political and slow decision making, no strategic function in satellite offices
Helpfu",,3,5,4,4,4,5,,,
Thu Feb 11 2021, Facility Manager,"Columbus, OH",Former Employee ,Meh,1,"Good benefits and pay for industry.
","high pace, stress, lack of safety focus
Helpful (1",,3,,,,,,,,
Tue Jan 26 2021, Software Engineer,"London, England",Current Employee ,Graduate Software Engineer,0,"Good pay, large scale systems
","Work-life balance is not that great
Helpfu",,5,,,,,,,,
Tue Jan 26 2021, Senior Technical Recruiter,"Menlo Park, CA",Current Employee ,Culture and benefits,0,"Comp, benefits, inclusive culture, culture, work life balance
","Work life balance is sometimes tricky
Helpfu",,5,4,5,5,5,5,Recommends,Positive Outlook,Approves of CEO
Tue Jan 26 2021, Manager,,Current Employee ,Good Company,0,"I thought it was Good salary
","I thought it was hard work
Helpfu",,5,5,5,5,5,5,Recommends,Positive Outlook,Approves of CEO
Tue Jan 26 2021, Marketing Coordinator,Singapore,Former Employee ,Great place to work,0,"Great manager and people in general - very knowledgable and competent team members. Free meals & snacks in the office help save time and money!
","As a contingent/contract worker, I did not get access to the full benefits (but still on par with the industry standards). Full-time employees are very well taken care of.
",,5,5,5,5,5,5,Recommends,Positive Outlook,Approves of CEO
Wed Jan 27 2021, Software Engineer,,Former Employee ,Great place,0,"Free food and nice treatment of software engineers
","I have nothing negative to say
Helpfu",,5,3,4,5,4,5,,,
Wed Jan 27 2021, Editor,,Current Employee ,Good,0,"That’s great news and I hope
","Time is the best challenge
",,5,,,,,,Recommends,Positive Outlook,
Wed Jan 27 2021, Editor,,Current Employee ,Good,0,"That’s great news and I hope
","Time is the best challenge
Advice to Management
I want to work more than a year
Helpfu","I want to work more than a year
Helpfu",5,,,,,,Recommends,Positive Outlook,
Wed Jan 27 2021, Software Engineer,"Menlo Park, CA",Current Employee ,Best employer in the industry,0,"Available projects. Freedom to work. Compensation & benefits.
","Poor middle management. Work life balance.
Helpfu",,5,3,5,5,5,5,Recommends,Positive Outlook,Approves of CEO
Tue Feb 09 2021, Software Engineer,"Menlo Park, CA",Former Employee ,pretty good,0,"""Openness"", which means you can see and submit diffs on almost everyone's code and you can see the direction and accomplishments of other teams
","""Move fast break things"" applies to internal tools and infrastructure. Things broke often enough that I remember it as an annoyance.
Helpfu",,4,4,4,4,4,5,Positive Outlook,,
Tue Feb 09 2021, Product Experience Analyst,"Seattle, WA",Current Employee ,"Great people, tools, buildings, perks and offsites!",0,"Flexibility in projects, great tools, really smart people.
","Reviews every 6 months keeps the pressure on.
",,4,3,4,4,4,5,Recommends,Positive Outlook,Approves of CEO
Tue Feb 09 2021,Anonymous,,Current Employee ,..,0,"International and diverse work, fastmoving
","Sometimes quite stressy , not structured
Helpfu",,4,3,4,5,3,4,,,
Wed Feb 10 2021, Software Engineer,"Austin, TX",Former Employee ,Fine place to work,0,"My team was relaxed. I enjoyed my manager.
","Perf review season is cut throat
Helpfu",,4,,,,,,,,
Wed Feb 10 2021, Public Policy Director,"Washington, DC",Current Employee ,"Great people, hard problems, stressful environment",0,"Great people and challenging problems to solve
","Chaotic work environment, stressful with amount of work that needs to be done
Helpfu",,4,2,4,3,4,5,Recommends,Positive Outlook,No Opinion of CEO
Wed Feb 10 2021, Telecommunications Engineer,"Denver, CO",Former Employee ,Telecommunications FaceBook,0,"Wonderful company to work for all-around. They go beyond that which is necessary to look after employees. The work site is also beautiful.
","There weren’t really any of which to speak.
",,4,5,5,5,4,4,,,
Sat Jan 23 2021, Senior Software Engineer,"Mountain View, CA",Former Employee ,Greate Experience,1,"The food variety was great
","The salmon provided was not smoked
Helpful (1",,5,,,,,,,,
Mon Jan 25 2021, Software Engineer,"San Francisco, CA",Current Employee ,Great company,0,"Challenging work, which is great.
","No downtime, which is also fine.
Helpfu",,5,5,5,5,5,5,,,
Mon Jan 25 2021, Data Scientist,"Menlo Park, CA",Former Employee ,Great place to work,0,"Lots of opportunities for big impact.
","Can be a good deal of bureaucracy
Helpfu",,5,5,5,5,5,5,Recommends,Positive Outlook,Approves of CEO
Wed Feb 10 2021, Telecommunications Engineer,"Denver, CO",Former Employee ,Telecommunications FaceBook,0,"Wonderful company to work for all-around. They go beyond that which is necessary to look after employees. The work site is also beautiful.
","There weren’t really any of which to speak.
Helpfu",,4,5,5,5,4,4,,,
Mon Jan 25 2021, Business Development Manager,New Delhi,Current Employee ,Good,0,"good is best way in office
","rumours about fake news In company
Helpfu",,5,,,,,,,,
Tue Jan 26 2021, Product Management,"San Jose, CA",Current Employee ,Built some new tech products,0,"Work life balance was good
","Didn’t like the product I worked on
Helpfu",,5,,,,,,,,
Tue Jan 26 2021, Financial Analyst,"San Francisco, CA",Current Employee ,Good company,0,"Pay, benefits, management and overall camraderie
","Not many to think of truly
Helpfu",,5,5,5,5,5,5,Recommends,Positive Outlook,Approves of CEO
Mon Feb 08 2021, Client Solutions Manager,"Los Angeles, CA",Current Employee ,"Large Corporation: Great Perks, Bad Culture",0,"The compensation here is amazing as well as the benefits they offer
","It is a very large corporation thus a difficult place to have an open or authentic culture. Bit robotic
Helpfu",,4,,,,,,,,
Mon Feb 08 2021, Software Engineer,,Current Employee ,Good Stuff,0,"You gain lots of experience, lots of highly motivated teammates.
","Workload can be stressful at times.
Helpfu",,4,,,,,,Recommends,Positive Outlook,Approves of CEO
Mon Feb 08 2021, Product Design Prototyper,"Seattle, WA",Current Employee ,Fun place to work,0,"Love the work I do. Motivated and likeable teammates.
","Sometimes gets stressful trying to be heard / seen.
Helpfu",,4,3,4,2,3,4,,,
Tue Feb 09 2021, Senior IOS Developer,"San Jose, CA",Former Employee ,Great experience,0,#NAME?,#NAME?,"All is good expect for workload
Helpfu",4,4,4,4,4,4,Recommends,Neutral Outlook,
Tue Feb 09 2021, Software Engineer,"Mountain View, CA",Former Employee ,Good,0,"Everything is good here. Work for sure.
","Nothing as far as I can tell except work load
Helpfu",,4,,,,,,,,
Wed Feb 10 2021, Data Engineer,,Former Employee ,Can anyone right this ship?,0,"Best healthcare I’ve ever experienced. Co-workers are talented and friendly. Work can provide a variety of interesting challenges.
","Core product does too much social harm so that every day I worked there was de-moralizing.
",,2,3,1,3,3,3,Doesn't Recommend,Negative Outlook,Disapproves of CEO
Mon Feb 08 2021, Program Manager,Singapore,Former Employee ,Good company with great benefits and constant change,0,"Benefits are one of the best in the IT market
","Constant change every few months, like a start-up. 
No role clarity
Helpfu",,3,3,4,5,5,5,Recommends,,Approves of CEO
Mon Feb 08 2021, Software Engineering Intern,,Former Employee ,Unhappy and I dont want to be writing a review,0,"good salary, people are helpful and friendly.
","not diverse, problematic and hypocritical culture.
Helpfu",,3,,,,,,,,
Tue Feb 09 2021, Software Test Engineer,"Seattle, WA",Current Employee ,dynamic but clique,0,"Fantastic tools and a real vibe to get things done
","Can be cliquey so merit alone may not get you where you want to be.
Helpfu",,3,,,,,,,,
Mon Jan 25 2021, Executive Assistant,"London, England",Former Employee ,Executive assistant,0,"Good fun company! Great free breakfast lunch and dinner !
","Can lack in structure sometimes
Helpfu",,5,4,5,5,5,5,Recommends,,Approves of CEO
Mon Jan 25 2021, Program Manager,"Dublin, Dublin",Current Employee ,Smart people and a great place to work,0,"Plenty of options to develop yourself, to learn and meet new people, there is a nice and relaxed work environment with a lot of autonomy to work the way you like, capable management who is enabling and kind and it's never boring :)
","Maybe ""too relaxed"" environment for someone who like a very structured and defined way of working. It's a big company with offices on multiple locations which can make it hard to know who to reach out to, talk to, go to.
Helpful
Facebook Response
February 10, 2021 – EMEA Recruitment Director
Thanks for the review and taking the time to write! 100% agree with you, it's certainly never boring in Facebook , at least from my perspective, and the pace of change is incredible on a daily basis! Thanks for your call out on the autonomy you get while working here, which we work hard to enshrine in our culture, and also for calling out the options for personal development in which we've invested heavily in to allow people the chance to really skill up on a wide variety of skills while here. We've a lot to improve and we'll keep focusing on how we can improve the employee experience. Sincerely, Decla",,5,5,5,5,5,5,Recommends,Positive Outlook,Approves of CEO
Sun Feb 07 2021, Production Engineer,"Menlo Park, CA",Current Employee ,"Good pay, disappointing leadership",0,"Good pay, great benefits, option to work remotely if E5+
","leadership decision making skills is bad. a lot of decision that I don't even understand a bit
Helpfu",,4,,,,,,Recommends,Neutral Outlook,Disapproves of CEO
Mon Feb 08 2021, Operations Specialist,,Former Employee ,Great Company but growing fast,0,"Great WLB and perks. Good compensation and impactful work
","Growing very fast
Diminishing swim lanes
Helpfu",,4,5,4,4,5,5,Recommends,Positive Outlook,Approves of CEO
Tue Feb 09 2021, Supervisor,,Former Employee ,Will weigh on your conscience,0,"Incredible benefits and compensation, they really strive to take care of their employees, concerns over benefits or clarifications are attended to quickly by a top notch benefits team
","Mark Zuckerberg is destroying democracy and won't listen to concerns from employees about it. It's a massive company but it's run by one person.
",,2,5,1,1,5,5,Doesn't Recommend,,Disapproves of CEO
Sun Jan 24 2021, Software Engineer,"Seattle, WA",Current Employee ,Good for engineer,0,"Many growth room for engineer
","Peer pressure is big as people are smart
Helpfu",,5,,,,,,,,
Sun Jan 24 2021, Senior Software Engineer,"San Francisco, CA",Former Employee ,Best Job Ever,0,"great pay, great co-workers, great benefits
","long hours, lack of diversity
Helpfu",,5,5,5,5,5,5,Recommends,Positive Outlook,Approves of CEO
Sun Jan 24 2021, Software Engineer,Tel Aviv-Yafo,Former Employee ,Good place for juniors,0,"The money us good, also I know how to write code now
","Huge company, it's can be hard sometimes
Helpfu",,5,4,5,4,3,5,Recommends,Neutral Outlook,No Opinion of CEO
Sun Jan 24 2021, Partner Solutions Manager,"London, England",Current Employee ,Great place to work,0,"Salary, Culture, Projects, People, Bonus
","Pay progression can be slow
Helpfu",,5,3,4,5,5,4,Recommends,Positive Outlook,Approves of CEO
Sun Jan 24 2021, SWE Manager,,Current Employee ,Amazing company to work for. One of the best in my career,0,"* Open and transparent 
* Fast moving
","* work life balance can be low sometimes
Helpfu",,5,3,5,4,5,5,,,
Sun Jan 24 2021, Critical Facility Engineer,"Los Lunas, NM",Current Employee ,CFE Facebook (Data Center),0,"Great perks, competitive pay and bonuses for motivated team players.
","Nothing to complain about at this time
Helpfu",,5,4,5,5,5,5,Recommends,Neutral Outlook,Approves of CEO
Sun Jan 24 2021, Software Engineer,,Current Employee ,Software Engineer,0,"Great people to work with and possibility to impact at massive scale.
","A person have to be proactive and comfortable fixing things.
Helpfu",,5,5,5,5,5,4,Recommends,,Approves of CEO
Sat Feb 06 2021, Product Manager,"Menlo Park, CA",Former Employee ,Great Company,0,"interesting projects and lots of autonomy
","too big. too may teams building similar products
Helpfu",,4,,,,,,,,
Sun Feb 07 2021, Accountant,Sydney,Former Employee ,Google,0,"Good environment, culture and people
","Work a little bit long hours
Helpfu",,4,,,,,,,,
Fri Jan 22 2021, Software Engineer,"New York, NY",Former Employee ,Software Engineer,0,"its very good work place to work
","not any cons that I can think of
Helpfu",,5,,,,,,,,
Fri Jan 22 2021, Recruiting Manager,"Menlo Park, CA",Current Employee ,Love it,0,"Great leadership
Amazing benefits 
Great people
","Work life balance
Red tape
Hard to juggle covid and work
Helpfu",,5,2,5,5,5,5,Recommends,Positive Outlook,Approves of CEO
Fri Jan 22 2021, Business Analyst,Bangalore,Current Employee ,Good place to work for,0,"Work life balance. Good learning curve
","No as such so far
",,5,,,,,,,,
Sat Jan 23 2021, Data Scientist,,Current Employee ,Overall Review,0,"Awesome place to work - very supportive and many smart people
","Hard to think of many
Helpfu",,5,,,,,,,,
